latitude,longitude,phone_number,link,address,store_name,nearest_location,state
19.1036079,72.8865104,+918042754444,https://restaurants.kfc.co.in/kfc-andheri-east-restaurants-andheri-east-mumbai-35073/Home,"SN 9, 15 & 16, Gr Flr, Sagar Palazio, Sakinaka Junction, Andheri East, Andheri East, Mumbai - 400072, Mumbai, -, 400072", Andheri East ,,Maharashtra
19.1185712,72.9113962,+918042754444,https://restaurants.kfc.co.in/kfc-powai-restaurants-powai-mumbai-35085/Home,"Powai Hiranandani Complex, Powai, Powai, Mumbai - 400072, Mumbai, -, 400072", Powai ,,Maharashtra
19.100342,72.9157901,+918042754444,https://restaurants.kfc.co.in/kfc-ghatkopar-east-restaurants-ghatkopar-east-mumbai-35126/Home,"3rd Floor, R City Mall, Food Court, LBS Road, Ghatkopar East, Ghatkopar East, Mumbai - 400077, Mumbai, -, 400077", Ghatkopar East ,,Maharashtra
19.183811,72.951571,+918042754444,https://restaurants.kfc.co.in/kfc-kfc-r-mall-mulund-restaurants-mulund-west-mumbai-132427/Home,"Shop No T5 & T6, 3rd Floor, Food Court, LBS Marg, Kamgar Colony, Mulund West, Mulund West, Mumbai - 400080, Mumbai, -, 400080", KFC R Mall Mulund ,,Maharashtra
18.9404369,72.8283147,+918042754444,https://restaurants.kfc.co.in/kfc-andheri-east-restaurants-andheri-east-mumbai-82055/Home,"Unit No 4 & 4A, CTS No 16, Hanuman Nagar, Kanakia Wall Street, Chakala, Andheri East, Andheri East, Mumbai - 400093, Mumbai, -, 400093", Andheri East , Near Andheri Kurla Road ,Maharashtra
19.0940191,72.8551624,+918042754444,https://restaurants.kfc.co.in/kfc-terminal-1a-restaurants-terminal-1a-mumbai-35142/Home,"No 1C, Food Court, Domestic Airport, Terminal 1A, Terminal 1A, Mumbai - 400099, Mumbai, -, 400099", Terminal 1A ,,Maharashtra
19.2033331,72.8599737,+918042754444,https://restaurants.kfc.co.in/kfc-kandivali-restaurants-kandivali-mumbai-35110/Home,"No 5, 3rd Flr, Food Court, Growels Mall, Kandivali, Kandivali, Mumbai - 400101, Mumbai, -, 400101", Kandivali ,,Maharashtra
19.218142,72.970337,+919870430904,https://restaurants.kfc.co.in/kfc-pokhran-thane-restaurants-thane-west-thane-315719/Home,"Shop No 2 to 4, Jagdale Avesa, Pokhran Road 2, Thane West, Thane West, Thane - 400606, Thane, -, 400606", Pokhran-Thane ,,Maharashtra
19.2035083,72.9646955,+918042754444,https://restaurants.kfc.co.in/kfc-thane-west-restaurants-thane-west-thane-35017/Home,"UN R4, 3rd Flr, Food Court, Korum Mall, Off Eastern Express Highway, Thane west, Thane west, Thane - 400606, Thane, -, 400606", Thane west , Next to Cadbury ,Maharashtra
19.2086746,72.9715242,+918042754444,https://restaurants.kfc.co.in/kfc-panchpakhadi-restaurants-panchpakhadi-thane-35023/Home,"Unit No FC11, 2nd Floor, Viviana Mall, Panchpakhadi, Panchpakhadi, Thane - 400606, Thane, -, 400606", Panchpakhadi , Next to Jupiter Hospital ,Maharashtra
19.255892,72.9836501,+918042754444,https://restaurants.kfc.co.in/kfc-hiranandani-estate-road-restaurants-hiranandani-estate-road-thane-35063/Home,"No S/1, The Walk, Hiranandani Estate Road, Hiranandani Estate Road, Thane - 400607, Thane, -, 400607", Hiranandani Estate Road ,,Maharashtra
19.181982,73.089745,+918850166087,https://restaurants.kfc.co.in/kfc-runwal-gardens-restaurants-dombivali-east-thane-315720/Home,"SN 74 to 76, R Galleria, Runwal Garden, Kalyan Shil Rd, Gharivali, Dombivali East, Dombivali East, Thane - 400612, Thane, -, 400612", Runwal Gardens ,,Maharashtra
19.0123111,73.0367511,+918042754444,https://restaurants.kfc.co.in/kfc-kfc-cbd-belapur-restaurants-belapur-sector-15-navi-mumbai-130405/Home,"Shop No 3 & 4, Ground Floor,Shiv Darshan, Plot No 1, Belapur, Sector 15, Belapur, Sector 15, Navi Mumbai - 400614, Navi Mumbai, -, 400614", KFC- CBD - Belapur , Near Bharat Petrol pump ,Maharashtra
19.2654501,72.9668901,+918042754444,https://restaurants.kfc.co.in/kfc-mk-plaza-thane-restaurants-ghodbunder-road-thane-286896/Home,"Ground & 1st Floor, MK Plaza, Ghodbunder Road, Ghodbunder Road, Thane - 400615, Thane, -, 400615", MK Plaza Thane ,,Maharashtra
19.065757,73.0006001,+918042754444,https://restaurants.kfc.co.in/kfc-vashi-restaurants-vashi-navi-mumbai-35104/Home,"Ground Floor, Inorbit Mall, Vashi, Vashi, Navi Mumbai - 400705, Navi Mumbai, -, 400705", Vashi , Near BSEL Tech Park ,Maharashtra
19.020657,73.019042,+918042754444,https://restaurants.kfc.co.in/kfc-sector-40-restaurants-sector-40-navi-mumbai-35059/Home,"Unit No S/48, Food Court, Level 2, PN R/1, Seawoods Railway St, Sector 40, Sector 40, Navi Mumbai - 400706, Navi Mumbai, -, 400706", Sector 40 , Seawoods Grand Central Mall ,Maharashtra
19.1477501,72.9994801,+918042754444,https://restaurants.kfc.co.in/kfc-airoli-sector-6-restaurants-airoli-sector-6-navi-mumbai-122909/Home,"PN 1, Shop No A10, A11, A13, A14 & A15, Madhuri, BK Marg, Airoli, Sector 6, Airoli, Sector 6, Navi Mumbai - 400708, Navi Mumbai, -, 400708"," Airoli, Sector 6 ",,Maharashtra
19.1039901,73.0036801,+918042754444,https://restaurants.kfc.co.in/kfc-kfc-koparkhairne-restaurants-koparkhairne-navi-mumbai-125719/Home,"SN 5 to 11, Yashwant Arcade Housing Soc, Plot No 56/58 & 90, Sector 6, Koparkhairne, Koparkhairne, Navi Mumbai - 400709, Navi Mumbai, -, 400709", KFC Koparkhairne , Near Teen Taki ,Maharashtra
19.268471,72.877211,+918042754444,https://restaurants.kfc.co.in/kfc-kfc-delta-vrindavan-mira-road-restaurants-mira-road-east-thane-136226/Home,"Shop No 18, Ground Floor, MIDC Road, Mira Road East, Mira Road East, Thane - 401107, Thane, -, 401107", KFC - Delta - Vrindavan - Mira Road , Opposite MBMC Water Tank ,Maharashtra
19.151411,72.835541,+918976884883,https://restaurants.kfc.co.in/kfc-kfc-vicino-mall-oshiwara-restaurants-oshiwara-vasai-168749/Home,"No 7 & 105, Vicino Mall, Andheri West, Jogeshwari Goregaon Link Road, Oshiwara, Oshiwara, Vasai - 401201, Vasai, -, 401201"," KFC Vicino Mall, Oshiwara ",,Maharashtra
19.468141,72.804871,+918042754444,https://restaurants.kfc.co.in/kfc-kfc-cosmos-square-restaurants-virar-west-virar-129146/Home,"Shop No 14, Cosmos Square, Global City, Chikhal Dongre Road, Virar West, Virar West, Virar - 401303, Virar, -, 401303", KFC Cosmos Square ,,Maharashtra
19.016401,73.1107701,+918042754444,https://restaurants.kfc.co.in/kfc-khalapur-restaurants-khalapur-raigarh-82039/Home,"A2/B & B1, Sy No 7 to 17, The Food Way, Sarsan, Sajgaon, Khalapur, Khalapur, Raigarh - 410202, Raigarh, -, 410202", Khalapur , Near Mumbai Pune Expressway ,Maharashtra
18.790801,73.2987201,+918042754444,https://restaurants.kfc.co.in/kfc-khalapur-restaurants-khalapur-khopoli-122932/Home,"S No 46, Shop No 19 & 20, Food Mall, Thanenhave, Khalapur, Khalapur, Khopoli - 410203, Khopoli, -, 410203", Khalapur ,,Maharashtra
18.969831,73.022499,+918097704553,https://restaurants.kfc.co.in/kfc-ulwe-navi-mumbai-restaurants-sector-18-ulwe-navi-mumbai-315722/Home,"PN 48, Sapphire Foods, Kritika Jewels, Sector 18, Ulwe, Sector 18, Ulwe, Navi Mumbai - 410206, Navi Mumbai, -, 410206", ULWE-Navi Mumbai ,,Maharashtra
18.9931721,73.1155841,+918042754444,https://restaurants.kfc.co.in/kfc-panvel-restaurants-panvel-navi-mumbai-35052/Home,"SN K/01 & 2, 2nd Flr, PN 311, Orion Mall, Food Court, Mumbai Pune Highway, Panvel, Panvel, Navi Mumbai - 410206, Navi Mumbai, -, 410206", Panvel ,,Maharashtra
18.795261,73.0289851,+918042754444,https://restaurants.kfc.co.in/kfc-kfc-little-world-mall-kharghar-restaurants-kharghar-sector-2-navi-mumbai-126981/Home,"Plot No 21, Gr Flr, Little World Mall, Pravesh Marg, Kharghar, Sector 2, Kharghar, Sector 2, Navi Mumbai - 410210, Navi Mumbai, -, 410210", KFC Little world mall Kharghar ,,Maharashtra
19.0304636,73.0657304,+918042754444,https://restaurants.kfc.co.in/kfc-kharghar-sector-2-restaurants-kharghar-sector-2-navi-mumbai-35115/Home,"SN G 12 to 14, 21 to 24, GF, Glomax Mall, PN 17 to 19, Kharghar, Sector 2, Kharghar, Sector 2, Navi Mumbai - 410210, Navi Mumbai, -, 410210"," Kharghar, Sector 2 ", Near Railway Station Road ,Maharashtra
18.759824,73.858329,+919923669679,https://restaurants.kfc.co.in/kfc-kfc-chakan-pune-restaurants-chakan-pune-315732/Home,"Shop No 38 to 42, UGF, The Grand Central, Khed, Chakan, Chakan, Pune - 410501, Pune, -, 410501", Kfc Chakan -pune ," Near Gate No 1638, 1639 ",Maharashtra
18.519644,73.877273,+918042754444,https://restaurants.kfc.co.in/kfc-camp-restaurants-camp-pune-35061/Home,"SGS Mall, Moledina Road, Camp, Camp, Pune - 411001, Pune, -, 411001", Camp , Near MG Road ,Maharashtra
18.5164922,73.8423478,+918042754444,https://restaurants.kfc.co.in/kfc-jm-marg-restaurants-jm-marg-pune-35026/Home,"Shop No 1 to 4, GF, Deccan Mall, JM Marg, JM Marg, Pune - 411004, Pune, -, 411004", JM Marg , Opposite To Deccan PMT Bus stand ,Maharashtra
18.510639,73.8388301,+918042754444,https://restaurants.kfc.co.in/kfc-karve-road-restaurants-karve-road-pune-35031/Home,"Unit No 2, MSM Mall, Karve Road, Karve Road, Pune - 411004, Pune, -, 411004", Karve Road , Near Garware College ,Maharashtra
18.564515,73.7744601,+918042754444,https://restaurants.kfc.co.in/kfc-haveli-restaurants-haveli-pune-35025/Home,"Show Room No 1, SN 115, GF, Tiara Bldg, Baner, Haveli, Haveli, Pune - 411007, Pune, -, 411007", Haveli ,,Maharashtra
18.560896,73.8069601,+918042754444,https://restaurants.kfc.co.in/kfc-aund-restaurants-aund-pune-35049/Home,"No 5, SF 2, 2nd Floor, West End Mall, WN 8, Wireless Col, Gurukul Park Rd, Aund, Aund, Pune - 411007, Pune, -, 411007", Aund ,,Maharashtra
18.519501,73.931601,+918042754444,https://restaurants.kfc.co.in/kfc-magarpatta-road-restaurants-magarpatta-road-pune-82038/Home,"UN T19 & T20, 3rd Floor, Seasons Mall, Magarpatta Road, Magarpatta Road, Pune - 411013, Pune, -, 411013", Magarpatta Road ,,Maharashtra
18.5549228,73.9476938,+918042754444,https://restaurants.kfc.co.in/kfc-kharadi-restaurants-kharadi-pune-66077/Home,"SN 4, Sy No 60, Gr Flr, Ganga Platino, Pradeep Plaza, West Wing, Kharadi, Kharadi, Pune - 411014, Pune, -, 411014", Kharadi , Next to WTC 2 ,Maharashtra
18.5627761,73.9163206,+918042754444,https://restaurants.kfc.co.in/kfc-nagar-road-restaurants-nagar-road-pune-35027/Home,"2nd Floor, Phoenix Market City Mall, Food Court, Nagar Road, Nagar Road, Pune - 411014, Pune, -, 411014", Nagar Road ,,Maharashtra
18.533728,73.8298701,+918042754444,https://restaurants.kfc.co.in/kfc-sb-road-restaurants-sb-road-pune-35060/Home,"GF, The Pavillion Mall, Food Court, International Convention Centre, SB Road, SB Road, Pune - 411015, Pune, -, 411015", SB Road , Next to J W Marriot ,Maharashtra
18.507691,73.783021,+918042754444,https://restaurants.kfc.co.in/kfc-kfc-bavdhan-restaurants-bavdhan-pune-133029/Home,"No 01, Dharamshi Milestone, Chandni Chowk, Bavdhan, Bavdhan, Pune - 411021, Pune, -, 411021", KFC- Bavdhan , Near Pune Cafe ,Maharashtra
18.505701,73.90640199,+918042754444,https://restaurants.kfc.co.in/kfc-wanowrie-restaurants-wanowrie-pune-79898/Home,"Unit No 304, 3rd Flr, 93 Avenue Mall, Kalubai Chowk, Fatima Nagar Jn, Wanowrie, Wanowrie, Pune - 411022, Pune, -, 411022", Wanowrie , Opposite Croma ,Maharashtra
18.593552,73.7859201,+918042754444,https://restaurants.kfc.co.in/kfc-pimpri-chinchwad-restaurants-pimpri-chinchwad-pune-35032/Home,"Spot 18 Building, Sunshine Villas, Rahatni Rd, Shivar Chowk, Pimpri Chinchwad, Pimpri Chinchwad, Pune - 411027, Pune, -, 411027", Pimpri Chinchwad ,,Maharashtra
18.5186104,73.9360892,+918042754444,https://restaurants.kfc.co.in/kfc-hadapsar-restaurants-hadapsar-pune-35030/Home,"UN EB/FF42 & 42D, Amanora Town Centre, Sadesatra Nali, Magarpatta, Hadapsar, Hadapsar, Pune - 411028, Pune, -, 411028", Hadapsar ,,Maharashtra
18.577544,73.907493,+919226191059,https://restaurants.kfc.co.in/kfc-kfc-aero-mall-pune-restaurants-lohegaon-pune-325650/Home,"Shop No 7, Sy No 225, GF, Aeromall, MLCP, Lohegaon, Lohegaon, Pune - 411032, Pune, -, 411032"," KFC - Aero Mall ,Pune ", Opposite Pune International Airport ,Maharashtra
18.6300601,73.7870201,+918042754444,https://restaurants.kfc.co.in/kfc-pimpri-chinchwad-restaurants-pimpri-chinchwad-pune-78631/Home,"UN FC 13, Elpro City Square Ward No 18, Pimpri Chinchwad, Pimpri Chinchwad, Pune - 411033, Pune, -, 411033", Pimpri Chinchwad ,,Maharashtra
18.501263,73.8726801,+918042754444,https://restaurants.kfc.co.in/kfc-gultekdi-restaurants-gultekdi-pune-35029/Home,"Unit No 08 & 09, Kumar Pacific Mall, CTS No 42 & 43, Shankarseth Rd, Gultekdi, Gultekdi, Pune - 411037, Pune, -, 411037", Gultekdi ,,Maharashtra
18.503157,73.819473,+919011553743,https://restaurants.kfc.co.in/kfc-kfc-kothrud-restaurants-kothrud-pune-315726/Home,"No 1, UGF, Himaguri Sunanda Apartment, Cts No 701, UGF, Karve Road, Kothrud, Kothrud, Pune - 411038, Pune, -, 411038", Kfc- Kothrud , Near Karishma Chs ,Maharashtra
18.485901,73.888649,+917218736554,https://restaurants.kfc.co.in/kfc-kfc-lulla-nagar-restaurants-lulla-nagar-pune-315730/Home,"SN 599A/598/593A, Marvel Vista, No 040, Lulla Nagar, Lulla Nagar, Pune - 411040, Pune, -, 411040", Kfc Lulla Nagar ,,Maharashtra
18.46731567,73.90105374,+918042754444,https://restaurants.kfc.co.in/kfc-khondhwa-khurd-restaurants-khondhwa-khurd-pune-107527/Home,"SN G1 to G3 &G32, Clover Hill Plaza Mall, Nimb Undri Road, Khondhwa Khurd, Khondhwa Khurd, Pune - 411048, Pune, -, 411048", Khondhwa Khurd ,,Maharashtra
18.635621,73.799987,+918042754444,https://restaurants.kfc.co.in/kfc-hinjewadi-restaurants-hinjewadi-pune-59013/Home,"S No 21/2, Wakad Hinjewadi Road, Hinjewadi, Hinjewadi, Pune - 411057, Pune, -, 411057", Hinjewadi , Beside Fortune Inn Hotel ,Maharashtra
18.5992773,73.7571953,+919518918840,https://restaurants.kfc.co.in/kfc-the-millenium-mall-wakad-pune-restaurants-wakad-pune-286898/Home,"No T/12, 3rd Floor, The Millenium Mall, Wakad, Wakad, Pune - 411057, Pune, -, 411057", The Millenium Mall - Wakad - Pune , Behind Sayaji hotel ,Maharashtra
18.488373,73.793518,+919860936886,https://restaurants.kfc.co.in/kfc-kfc-warje-pune-restaurants-warje-pune-315723/Home,"Shop No 1, Sr No 113/l, Ghosale Palatial, Plot No 3c, Mumbai Bangalore ByPass, Warje, Warje, Pune - 411058, Pune, -, 411058", Kfc - Warje Pune , Near Rmd Sinhagad College ,Maharashtra
18.401561,76.564941,+918042754444,https://restaurants.kfc.co.in/kfc-kfc-latur-restaurants-ambajogai-road-latur-127821/Home,"Ground Floor, Kayamkhani Estate, Ambajogai Road, Ambajogai Road, Latur - 413512, Latur, -, 413512", KFC - Latur , Near Shivaji Chowk ,Maharashtra
19.2890901,72.865101,+918042754444,https://restaurants.kfc.co.in/kfc-mira-bhayendar-highway-restaurants-mira-bhayendar-highway-satara-35024/Home,"Shop No 1 to 3, Sheetal Classic Corner, Sai Karishma CHS, Mira Bhayendar Highway, Mira Bhayendar Highway, Satara - 415517, Satara, -, 415517", Mira Bhayendar Highway ,,Maharashtra
16.990591,73.307085,+919890588571,https://restaurants.kfc.co.in/kfc-kfc-ratnagiri-restaurants-zadgaon-ratnagiri-325649/Home,"No 870, Main Road, Malnaka, Zadgaon, Zadgaon, Ratnagiri - 415612, Ratnagiri, -, 415612", KFC - Ratnagiri , Near Hotel Vihar Deluxe ,Maharashtra
16.482561,74.611311,+918042754444,https://restaurants.kfc.co.in/kfc-kfc-sangli-restaurants-wanlesswadi-sangli-126982/Home,"SN G1 to 3, 10 & 11, Shiv City Centra, Sangli Miraj Road, Wanlesswadi, Wanlesswadi, Sangli - 416416, Sangli, -, 416416", KFC Sangli , Near Collector Bhavan ,Maharashtra
19.165701,73.075301,+918042754444,https://restaurants.kfc.co.in/kfc-dombivli-east-restaurants-dombivli-east-thane-59018/Home,"Food Court, Xperia Mall, Casa Bella Gold, Palava City, Shilphata Road, Dombivli East, Dombivli East, Thane - 421204, Thane, -, 421204", Dombivli East , Opposite Lodha World School ,Maharashtra
19.252964,73.136734,+918652130611,https://restaurants.kfc.co.in/kfc-kfc-khadakpada-kalyan-restaurants-kalyan-thane-315729/Home,"Shop No 11 &12 At Ground & 1st Floor, Khadakpada Circle, Kalyan, Kalyan, Thane - 421301, Thane, -, 421301", Kfc khadakpada-kalyan , Near Rockmount Residency ,Maharashtra
19.2284959,73.110001,+918042754444,https://restaurants.kfc.co.in/kfc-kalyan-east-restaurants-kalyan-east-thane-107525/Home,"No KS 10, 2nd Flr, Metro Junction Mall, Store No 3 & 4, Shil Rd, Kalyan East, Kalyan East, Thane - 421306, Thane, -, 421306", Kalyan East , Netivali Baugh ,Maharashtra
19.202501,73.1724601,+918042754444,https://restaurants.kfc.co.in/kfc-kansai-restaurants-kansai-ambernath-118608/Home,"Plot No F/4 /1 & F/4/2, Diagonally, Kansai, Kansai, Ambernath - 421501, Ambernath, -, 421501", Kansai , Next to Reliance Petrol Pump ,Maharashtra
19.990625,73.762115,+917558379005,https://restaurants.kfc.co.in/kfc-kfc-city-center-mall-nashik-restaurants-lawate-nagar-nashik-315725/Home,"FC 3B & FC 4, 3rd Flr, City Centre Mall, Food Court, Untwadi, Lawate Nagar, Lawate Nagar, Nashik - 422002, Nashik, -, 422002", KFC -City Center Mall - Nashik ,,Maharashtra
20.007201,73.763801,+918042754444,https://restaurants.kfc.co.in/kfc-thatte-nagar-restaurants-thatte-nagar-nashik-78630/Home,"SN 1, GF, Metro 99, Commercial Complex, PN 456, Gangapur Link Road, Thatte Nagar, Thatte Nagar, Nashik - 422005, Nashik, -, 422005", Thatte Nagar , College Road ,Maharashtra
19.956245,73.758111,+919511838138,https://restaurants.kfc.co.in/kfc-kfc-pathardi-phata-nashik-restaurants-pathardi-phata-nashik-325647/Home,"Shop No 1, 2 & 3, Pashan Pushpa, Mumbai Agra Road, Pathardi phata, Pathardi phata, Nashik - 422010, Nashik, -, 422010", KFC Pathardi phata Nashik ,,Maharashtra
19.6953701,73.5952801,+918042754444,https://restaurants.kfc.co.in/kfc-bortembhe-restaurants-bortembhe-nashik-107796/Home,"Shop No 8A & 8B, Food Hills, NH 3, Bortembhe, Bortembhe, Nashik - 422403, Nashik, -, 422403", Bortembhe , Near IOCL Pump ,Maharashtra
21.007438,75.546994,+919850818828,https://restaurants.kfc.co.in/kfc-kfc-nh-06-jalgaon-restaurants-shiv-colony-jalgaon-315733/Home,"CT Survey No 51/IA, NF No 6, Plot No 14, NH 6, Shiv Colony, Shiv Colony, Jalgaon - 425001, Jalgaon, -, 425001"," KFC NH-06, Jalgaon ", Near Bus Stop ,Maharashtra
19.876341,75.3724201,+918042754444,https://restaurants.kfc.co.in/kfc-chikalthana-industrial-estate-restaurants-chikalthana-industrial-estate-aurangabad-35018/Home,"Unit R6, 1st Floor, Prozone Mall, Chikalthana Industrial Estate, Chikalthana Industrial Estate, Aurangabad - 431210, Aurangabad, -, 431210", Chikalthana Industrial Estate ,,Maharashtra
21.1329833,79.0964581,+918042754444,https://restaurants.kfc.co.in/kfc-untkhana-restaurants-untkhana-nagpur-82056/Home,"SN FC 12 & 13, 3rd Floor, Trilium Mall, Medical Square, Rambagh Layout, Untkhana, Untkhana, Nagpur - 440003, Nagpur, -, 440003", Untkhana ,,Maharashtra
21.143365,79.0804701,+918042754444,https://restaurants.kfc.co.in/kfc-sitabuldi-restaurants-sitabuldi-nagpur-35130/Home,"G1, G2, Ground Floor, Eternity Mall, Variety square, Sitabuldi, Sitabuldi, Nagpur - 440012, Nagpur, -, 440012", Sitabuldi ,,Maharashtra
21.1230101,79.0575019,+918042754444,https://restaurants.kfc.co.in/kfc-shraddhanand-peth-restaurants-shraddhanand-peth-nagpur-102965/Home,"House No 128/A/2, Ground Floor, South Ambazari Road, Shraddhanand Peth, Shraddhanand Peth, Nagpur - 440022, Nagpur, -, 440022", Shraddhanand Peth ,,Maharashtra
24.789667,93.941055,+919064275928,https://restaurants.kfc.co.in/kfc-kfc-singjamei-restaurants-moirangkhom-loklaobung-imphal-175477/Home,"Ground Floor, Moirangkhom Loklaobung, Moirangkhom Loklaobung, Imphal - 795001, Imphal, -, 795001", KFC Singjamei ,,Manipur
24.8187831,93.9389215,+918826111444,https://restaurants.kfc.co.in/kfc-thangheiband-lourung-leikai-restaurants-thangheiband-lourung-leikai-imphal-59014/Home,"Mamcy Mall, lmphal West, Thangheiband Lourung Leikai, Thangheiband Lourung Leikai, Imphal - 795001, Imphal, -, 795001", Thangheiband Lourung Leikai ,,Manipur
24.332933,93.694126,+918415060656,https://restaurants.kfc.co.in/kfc-kfc-churachandpur-imphal-restaurants-gocinkhup-veng-churachandpur-197670/Home,"Shop No 145, GS Cottage, New Lamka, Gocinkhup Veng, Gocinkhup Veng, Churachandpur - 795006, Churachandpur, -, 795006", KFC Churachandpur- Imphal ,,Manipur
25.576499,91.8824501,+918794724106,https://restaurants.kfc.co.in/kfc-police-bazar-restaurants-police-bazar-shillong-34926/Home,"2nd Floor, Marbahub, Police Bazar, Police Bazar, Shillong - 793001, Shillong, -, 793001", Police Bazar ,,Meghalaya
25.57129935,91.89617483,+917605028557,https://restaurants.kfc.co.in/kfc-east-khasi-hills-restaurants-east-khasi-hills-shillong-66078/Home,"Anderson Plaza, Laitumkhrah Main Road, East Khasi Hills, East Khasi Hills, Shillong - 793003, Shillong, -, 793003", East Khasi Hills , Opposite Laitumkhrah Post Office ,Meghalaya
25.567794,91.912781,+918588827568,https://restaurants.kfc.co.in/kfc-kfc-nongmynsong-meghalaya-restaurants-nongmynsong-east-khasi-hills-184623/Home,"Umkdait, East Khasi Hills Town, Nongmynsong, Nongmynsong, East Khasi Hills - 793019, East Khasi Hills, -, 793019", KFC- Nongmynsong Meghalaya ,,Meghalaya
25.454937,92.203652,+918929627831,https://restaurants.kfc.co.in/kfc-jowai-meghalaya-restaurants-jowai-jaintia-hills-289421/Home,"Ground & First Floor, Ladthalobah, Lumpariat, Jowai, Jowai, Jaintia Hills - 793150, Jaintia Hills, -, 793150", Jowai Meghalaya ,,Meghalaya
23.7242281,92.7247297,+918042754444,https://restaurants.kfc.co.in/kfc-kfc-collage-veng-aizwal-restaurants-collage-veng-aizawl-302119/Home,"Ground Floor, Collage Veng, Collage Veng, Aizawl - 796001, Aizawl, -, 796001", KFC Collage Veng Aizwal , Near Collage Veng Feild ,Mizoram
23.718314,92.714747,+917605028782,https://restaurants.kfc.co.in/kfc-khatla-restaurants-khatla-aizawl-109256/Home,"No E8, 1st Floor, Peter Park Street, Khatla, Khatla, Aizawl - 796001, Aizawl, -, 796001", Khatla ,,Mizoram
23.738705,92.7165701,+917428965914,https://restaurants.kfc.co.in/kfc-chanmari-restaurants-chanmari-aizawl-34956/Home,"G 39, Chanmari, Chanmari, Aizawl - 796007, Aizawl, -, 796007", Chanmari ,,Mizoram
23.738779,92.710385,+919711635121,https://restaurants.kfc.co.in/kfc-kfc-vivakwan-aizawl-restaurants-vaivakawn-aizawl-200817/Home,"VC 127/2, Zotlang Peng, Vaivakawn, Vaivakawn, Aizawl - 796009, Aizawl, -, 796009", KFC Vivakwan Aizawl , Opposite Bus Stand ,Mizoram
23.754711,92.730211,+918527977008,https://restaurants.kfc.co.in/kfc-kfc-bawngkawn-restaurants-bawngkawn-aizawl-172169/Home,"No 7/S & 9A, Zorin Enterprise, Highstreet, Bawngkawn, Bawngkawn, Aizawl - 796014, Aizawl, -, 796014", KFC - Bawngkawn , Opposite Bazaar Peng ,Mizoram
23.4796101,93.3292901,+918588050185,https://restaurants.kfc.co.in/kfc-kfc-champhai-restaurants-bethel-veng-champhai-252875/Home,"Sihdim Road, Bethel Veng, Bethel Veng, Champhai - 796321, Champhai, -, 796321", KFC Champhai ,,Mizoram
22.884181,92.746891,+918527762463,https://restaurants.kfc.co.in/kfc-kfc-lunglei-restaurants-chanmari-lunglei-176785/Home,"No MZ 02/15C/2, H No 16C, Chanmari, Chanmari, Lunglei - 796701, Lunglei, -, 796701", KFC Lunglei , Opposite Faith Hospital ,Mizoram
25.677413,94.109331,+918527313900,https://restaurants.kfc.co.in/kfc-ag-colony-restaurants-ag-colony-kohima-34976/Home,"Plot No 2046, Ground & 1st Floor, Ward No 3, AG Colony, AG Colony, Kohima - 797001, Kohima, -, 797001", AG Colony ,,Nagaland
25.906907,93.734213,+919147012323,https://restaurants.kfc.co.in/kfc-kfc-dimapur-2-restaurants-nagarjan-dimapur-128830/Home,"Dag No 287, Patta No 60, Pauna Complex, WN 5, Blk 3,Mouza 3, Bank Col, Nagarjan, Nagarjan, Dimapur - 797112, Dimapur, -, 797112", KFC Dimapur 2 , Opposite Town Hall ,Nagaland
25.9073799,92.7194025,+919899579904,https://restaurants.kfc.co.in/kfc-midland-dimapur-restaurants-midland-dimapur-300645/Home,"Ground floor, Jakalu Building, PWD Road, Midland, Midland, Dimapur - 797112, Dimapur, -, 797112"," Midland, Dimapur ",,Nagaland
25.911331,93.7200501,+919903312999,https://restaurants.kfc.co.in/kfc-circular-road-restaurants-circular-road-dimapur-34951/Home,"Nagi House, Circular Road, Circular Road, Dimapur - 797112, Dimapur, -, 797112", Circular Road ,,Nagaland
25.891719,93.757873,+919899311735,https://restaurants.kfc.co.in/kfc-kfc-arai-mile-dimapur-restaurants-darogapathar-dimapur-305060/Home,"Arai Mile, Darogapathar, Darogapathar, Dimapur - 797112, Dimapur, -, 797112"," KFC Arai Mile, Dimapur ", Near Kin School compound ,Nagaland
25.819387,93.780982,+919899091859,https://restaurants.kfc.co.in/kfc-kfc-chumukedima-restaurants-chumukedima-dimapur-273984/Home,"Ward No 3, Keviletuo Complex, Chumukedima, Chumukedima, Dimapur - 797115, Dimapur, -, 797115", KFC Chumukedima , Opposite Digi Prompt Enterpris ,Nagaland
20.277067,85.843901,+919643026763,https://restaurants.kfc.co.in/kfc-kharbal-nagar-restaurants-kharbal-nagar-bhubaneswar-34949/Home,"No 6 Janpath, Unit 3, Kharbal Nagar, Kharbal Nagar, Bhubaneswar - 751001, Bhubaneswar, -, 751001", Kharbal Nagar , Opposite Ram Mandir ,Odisha
20.278282,85.796886,+918506839779,https://restaurants.kfc.co.in/kfc-baramunda-restaurants-baramunda-bus-stand-bhubaneswar-235110/Home,"Plot M15, Baramunda Housing Board Colony, NH 16, Baramunda Bus Stand, Baramunda Bus Stand, Bhubaneswar - 751003, Bhubaneswar, -, 751003", Baramunda , Opposite Fire Station ,Odisha
20.2908462,85.8559439,+919903774740,https://restaurants.kfc.co.in/kfc-rasulagarh-restaurants-rasulagarh-bhubaneswar-82040/Home,"FS/2/01/SU/2/06, Forum Esplanade Mall, End of Bomikhal Overbridge, Rasulagarh, Rasulagarh, Bhubaneswar - 751010, Bhubaneswar, -, 751010", Rasulagarh , Near Bomikhal Overbridge ,Odisha
20.2986319,85.82315602,+918929964570,https://restaurants.kfc.co.in/kfc-jaidev-vihar-restaurants-jaidev-vihar-bhubaneswar-34938/Home,"Plot No J/7, Pal Heights Mall, Jaidev Vihar, Jaidev Vihar, Bhubaneswar - 751013, Bhubaneswar, -, 751013", Jaidev Vihar ,,Odisha
20.256155,85.840255,+919810964851,https://restaurants.kfc.co.in/kfc-gautam-nagar-restaurants-gautam-nagar-bhubaneswar-77738/Home,"SN TF 301, Utkal Kanika Galleria, Gautam Nagar St, Gautam Nagar, Gautam Nagar, Bhubaneswar - 751014, Bhubaneswar, -, 751014", Gautam Nagar , Opposite Odisha State Museum ,Odisha
