latitude,longitude,phone_number,link,address,store_name,nearest_location,state
11.02352111,76.90967111,+914224712971,https://restaurants.kfc.co.in/kfc-kfc-vadavalli-restaurants-vadavalli-coimbatore-178953/Home,"Unit 1, No 29, Ground Floor, MGPS Shopping Mall, MG Colony, Vadavalli, Vadavalli, Coimbatore - 641041, Coimbatore, -, 641041", KFC Vadavalli ,,Tamil Nadu
10.85614611,76.86211911,+918042754444,https://restaurants.kfc.co.in/kfc-kfc-walayar-restaurants-walayar-coimbatore-179478/Home,"No 285, CGV Center, Palakkad Road, Navakarai, Walayar, Walayar, Coimbatore - 641105, Coimbatore, -, 641105", KFC Walayar ,,Tamil Nadu
11.11642111,77.33458111,+914214050016,https://restaurants.kfc.co.in/kfc-kfc-tiruppur-restaurants-avinashi-road-tiruppur-178947/Home,"317/220/2, Ground Floor, Gobald Square, Avinashi Road, Avinashi Road, Tiruppur - 641603, Tiruppur, -, 641603", KFC Tiruppur ,,Tamil Nadu
11.411121,76.707681,+918042754444,https://restaurants.kfc.co.in/kfc-kfc-ooty-restaurants-commercial-rd-ooty-128135/Home,"355 A/1, The Nilgiris Coop Ent Complex, S No 1766/6, Charring Cross, Commercial Rd, Commercial Rd, Ooty - 643001, Ooty, -, 643001", Kfc Ooty ,,Tamil Nadu
17.395001,78.4759399,+918042754444,https://restaurants.kfc.co.in/kfc-abids-road-restaurants-abids-road-hyderabad-35154/Home,"H No 5/9/322, TS No 86, Ward No 51, GF, F Block, Gun foundry, Abids Road, Abids Road, Hyderabad - 500001, Hyderabad, -, 500001", Abids Road ,,Telangana
17.435958,78.488351,+918042754444,https://restaurants.kfc.co.in/kfc-mg-road-restaurants-mg-road-hyderabad-35148/Home,"H No 2/4/59 to 62 & 2/4/91 to 92, Ankita Arcade, MG Road, MG Road, Hyderabad - 500003, Hyderabad, -, 500003", MG Road ,,Telangana
17.4336565,78.4996684,+918042754444,https://restaurants.kfc.co.in/kfc-bhoiguda-restaurants-bhoiguda-hyderabad-59005/Home,"Food Plaza, Platform No 1, Secunderabad Railway Station, Bhoiguda, Bhoiguda, Hyderabad - 500003, Hyderabad, -, 500003", Bhoiguda ,,Telangana
17.406946,78.40191202,+919542858825,https://restaurants.kfc.co.in/kfc-shaikpet-restaurants-shaikpet-hyderabad-106307/Home,"8/1/301, 8/1/302 & 8/1/303, GF & 1st Flr, Shaikpet, Shaikpet, Hyderabad - 500008, Hyderabad, -, 500008", Shaikpet ,,Telangana
17.456656,78.499506,+918042754444,https://restaurants.kfc.co.in/kfc-vikrampuri-colony-restaurants-vikrampuri-colony-rangareddy-35149/Home,"Plot No B1, Kharkhana Road, Vikrampuri Colony, Vikrampuri Colony, Rangareddy - 500009, Rangareddy, -, 500009", Vikrampuri Colony ,,Telangana
17.508745,78.504128,+917288818713,https://restaurants.kfc.co.in/kfc-kfc-alwal-hyderabad-restaurants-alwal-hyderabad-243335/Home,"Mallikarjuna Complex, Suryanagar, Alwal Road, Alwal, Alwal, Hyderabad - 500010, Hyderabad, -, 500010", KFC Alwal Hyderabad , Near Indira Gandhi Statue ,Telangana
17.5261711,78.4852461,+919711830742,https://restaurants.kfc.co.in/kfc-kfc-kompally-restaurants-kompally-rangareddy-182973/Home,"Sy No 103/B, Brundavan Colony, RR, Quthbullapur Mandal, Kompally, Kompally, Rangareddy - 500014, Rangareddy, -, 500014", KFC Kompally ,,Telangana
17.472563,78.510132,+919704559184,https://restaurants.kfc.co.in/kfc-kfc-tirumalgiri-restaurants-tirumalgiri-secunderabad-178145/Home,"Lalbazar, Tirumalgiri, Tirumalgiri, Secunderabad - 500015, Secunderabad, -, 500015", KFC Tirumalgiri , Opposite Tirumalgiri Police Station ,Telangana
17.47979501,78.31681001,+919908375871,https://restaurants.kfc.co.in/kfc-kfc-serilingampally-restaurants-serilingampally-hyderabad-179494/Home,"Plot No 23, HG & FF, Nallagandla Road, Serilingampally, Serilingampally, Hyderabad - 500016, Hyderabad, -, 500016", KFC Serilingampally ,,Telangana
17.5192871,78.3779303,+918309885209,https://restaurants.kfc.co.in/kfc-kfc-nizampet-restaurants-nizampet-road-hyderabad-180030/Home,"No 1/123/C/1/JLC/A/1, 1st Floor, Rangareddy, Nizampet Road, Nizampet Road, Hyderabad - 500016, Hyderabad, -, 500016", KFC Nizampet , Opposite Water Tank ,Telangana
17.467961,78.428411,+918447203278,https://restaurants.kfc.co.in/kfc-kfc-moosapet-restaurants-moosapet-main-road-hyderabad-167975/Home,"Ground Floor, Asian Laxmikala Cine Pride, Moosapet Main Road, Moosapet Main Road, Hyderabad - 500018, Hyderabad, -, 500018", KFC Moosapet ,,Telangana
17.434326,78.3865101,+918042754444,https://restaurants.kfc.co.in/kfc-madhapur-restaurants-madhapur-hyderabad-35221/Home,"64, APIIC Software Layout, Inorbit Mall, F & B 14B, Hi Tech City, Madhapur, Madhapur, Hyderabad - 500018, Hyderabad, -, 500018", Madhapur ,,Telangana
17.46790365,78.31026714,+918861825869,https://restaurants.kfc.co.in/kfc-kfc-aparna-mall-nallagandla-restaurants-serlingampally-east-godavari-310792/Home,"SN 282, 294 EE & 294, Aparna Mall, Circle No 20, Nallagandla, Serlingampally, Serlingampally, East Godavari - 500019, East Godavari, -, 500019", Kfc Aparna Mall Nallagandla ,,Telangana
16.481973,80.618618,+919289360052,https://restaurants.kfc.co.in/kfc-tadepalli-restaurants-tadepalle-east-godavari-307021/Home,"Survey No 114/C3, Eswar Elite, NH 16, Service Road, Tadepalle, Tadepalle, East Godavari - 500019, East Godavari, -, 500019", Tadepalli , Beside Sonovision Show Room ,Telangana
17.424901,78.506838,+919873593994,https://restaurants.kfc.co.in/kfc-kfc-padmarao-restaurants-padmarao-ngr-hyderabad-281092/Home,"No 6/1/126 & 127, Old No 1/A, Walker Tn, M Migh col, Secunderabad, Padmarao Ngr, Padmarao Ngr, Hyderabad - 500025, Hyderabad, -, 500025", KFC Padmarao ,,Telangana
17.4482401,78.503423,+918588805306,https://restaurants.kfc.co.in/kfc-kfc-maredpally-secunderabad-restaurants-west-maredpally-hyderabad-258121/Home,"No 10/2/42/A & C, Plot No 79/A & C, West Maredpally, West Maredpally, Hyderabad - 500026, Hyderabad, -, 500026", KFC Maredpally Secunderabad ,,Telangana
17.389111,78.497114,+917428087600,https://restaurants.kfc.co.in/kfc-kfc-kachiguda-restaurants-kachiguda-hyderabad-130736/Home,"Ground Floor, Ganeriwal Complex, Main Road, Kachiguda, Kachiguda, Hyderabad - 500027, Hyderabad, -, 500027", KFC Kachiguda , Opposite Kumar Theater ,Telangana
17.396409,78.443061,+918042754444,https://restaurants.kfc.co.in/kfc-humayun-nagar-restaurants-humayun-nagar-hyderabad-35197/Home,"Municipal Door No 10/3/76, Ground Floor, Mehdipatnam, Humayun Nagar, Humayun Nagar, Hyderabad - 500028, Hyderabad, -, 500028", Humayun Nagar ,,Telangana
17.401534,78.485791,+918042754444,https://restaurants.kfc.co.in/kfc-himayatnagar-restaurants-himayatnagar-hyderabad-35206/Home,"Sy No 3/6/552/558, MPM Millenium Mall, Himayatnagar, Himayatnagar, Hyderabad - 500029, Hyderabad, -, 500029", Himayatnagar ,,Telangana
17.4217701,78.3386801,+917605028783,https://restaurants.kfc.co.in/kfc-gachibowli-restaurants-gachibowli-hyderabad-108372/Home,"Financial District, ISB Road, Nanakramguda, Gachibowli, Gachibowli, Hyderabad - 500032, Hyderabad, -, 500032", Gachibowli ,,Telangana
17.635865,78.485656,+919391143469,https://restaurants.kfc.co.in/kfc-kfc-medchal-restaurants-hi-street-hyderabad-198163/Home,"PN 43 & 62, Sy No 80, 81/1 & 86, Medchal, RR, HI Street, HI Street, Hyderabad - 500034, Hyderabad, -, 500034", KFC Medchal ,,Telangana
17.423336,78.4279301,+918042754444,https://restaurants.kfc.co.in/kfc-banjara-hills-restaurants-banjara-hills-hyderabad-35161/Home,"Ground Floor, RK Cineplex Mall, Road No 2, Banjara Hills, Banjara Hills, Hyderabad - 500034, Hyderabad, -, 500034", Banjara Hills ,,Telangana
17.4192363,78.4483246,+918042754444,https://restaurants.kfc.co.in/kfc-banjara-hills-restaurants-banjara-hills-hyderabad-35164/Home,"No 1 & 2, Level 3, GVK One Mall, Road No 1, Banjara Hills, Banjara Hills, Hyderabad - 500034, Hyderabad, -, 500034", Banjara Hills ,,Telangana
17.442791,78.357271,+918042754444,https://restaurants.kfc.co.in/kfc-serlingampally-restaurants-serlingampally-hyderabad-35184/Home,"Survey No 124, Ground Floor, Gachibowli, Serlingampally, Serlingampally, Hyderabad - 500034, Hyderabad, -, 500034", Serlingampally ,,Telangana
17.407736,78.444312,+919899307438,https://restaurants.kfc.co.in/kfc-kfc-banjara-hills-restaurants-banjara-hills-hyderabad-305303/Home,"SN 12, Banjara Hills Road No 12, Sri Ram Nagar Colony, Banjara Hills, Banjara Hills, Hyderabad - 500034, Hyderabad, -, 500034", KFC Banjara hills , Near Ramchandani Construction ,Telangana
17.367579,78.540571,+918042754444,https://restaurants.kfc.co.in/kfc-saroornagar-restaurants-saroornagar-hyderabad-35183/Home,"No 11/309/1/2, Survey No 9/1, Kothapet X Road, RR, Saroornagar, Saroornagar, Hyderabad - 500035, Hyderabad, -, 500035", Saroornagar ,,Telangana
17.371675,78.509558,+917428195954,https://restaurants.kfc.co.in/kfc-moosarambagh-restaurants-moosarambagh-hyderabad-66658/Home,"Unit No L5 01,02 & 03, New Malakpet, Moosarambagh, Moosarambagh, Hyderabad - 500036, Hyderabad, -, 500036", Moosarambagh ,,Telangana
17.399702,78.554974,+918179816487,https://restaurants.kfc.co.in/kfc-uppal-rr-restaurants-uppal-rr-hyderabad-78489/Home,"No TF 09, Plot No B 1/1,B1/2,B,1/B&B2, Uppal Ramanthapur Main Road, Uppal RR, Uppal RR, Hyderabad - 500039, Hyderabad, -, 500039", Uppal RR ,,Telangana
17.4638252,78.5605854,+918588812242,https://restaurants.kfc.co.in/kfc-kfc-amr-planet-mall-restaurants-moula-ali-hyderabad-183044/Home,"Food Court, AMR Planet Mall, Eshwar Nagar, Moula Ali, Moula Ali, Hyderabad - 500040, Hyderabad, -, 500040", KFC AMR Planet Mall ,,Telangana
17.392159,78.510639,+917042253940,https://restaurants.kfc.co.in/kfc-kfc-shivam-road-restaurants-shivam-road-hyderabad-167974/Home,"Ground Floor, Vasanthi Meridian, Amberpet, Tilak Nagar, Shivam Road, Shivam Road, Hyderabad - 500044, Hyderabad, -, 500044", KFC Shivam Road ,,Telangana
17.355849,78.422566,+918008963766,https://restaurants.kfc.co.in/kfc-attapur-road-restaurants-attapur-road-hyderabad-107798/Home,"Pillar No 175, Happy Homes Fortuna, Attapur Road, Attapur Road, Hyderabad - 500048, Hyderabad, -, 500048", Attapur Road ,,Telangana
17.4964542,78.3729359,+917330967667,https://restaurants.kfc.co.in/kfc-miyapur-restaurants-miyapur-hyderabad-122920/Home,"SE 01, Concurse Level, Miyapur, Miyapur, Hyderabad - 500049, Hyderabad, -, 500049", Miyapur ,,Telangana
17.494872,78.35604402,+918042754444,https://restaurants.kfc.co.in/kfc-miyapur-restaurants-miyapur-hyderabad-35185/Home,"Plot No 8, 9, 14 & 15, Survey No 221, Madinaguda, Miyapur, Miyapur, Hyderabad - 500049, Hyderabad, -, 500049", Miyapur , Beside Vijetha Super Market ,Telangana
17.496599,78.335645,+919311855032,https://restaurants.kfc.co.in/kfc-madinaguda-restaurants-madinaguda-hyderabad-66888/Home,"7,8, 3rd Flr, GSM Mall Cum Multiplex, Miyapur Main Rd, Chanda Nagar, Madinaguda, Madinaguda, Hyderabad - 500050, Hyderabad, -, 500050", Madinaguda ,,Telangana
17.368594,78.5257301,+917303419381,https://restaurants.kfc.co.in/kfc-dilsukhnagar-metro-station-restaurants-dilsukhnagar-metro-station-hyderabad-121862/Home,"S 04, Concourse Level, Dilsukhnagar Metro Station, Dilsukhnagar Metro Station, Hyderabad - 500060, Hyderabad, -, 500060", Dilsukhnagar Metro Station ,,Telangana
17.4814659,78.55524125,+918042754444,https://restaurants.kfc.co.in/kfc-dr-as-rao-nagar-restaurants-dr-as-rao-nagar-hyderabad-35211/Home,"Shop No GI, PNR SSV Complex, Plot No A13, Main Road, Dr AS Rao Nagar, Dr AS Rao Nagar, Hyderabad - 500062, Hyderabad, -, 500062", Dr AS Rao Nagar ,,Telangana
17.418701,78.4451701,+919311091116,https://restaurants.kfc.co.in/kfc-imax-road-restaurants-imax-road-hyderabad-82053/Home,"Prasads Imax Multiplex, LIC Division, NTR Marg, Imax Road, Imax Road, Hyderabad - 500063, Hyderabad, -, 500063", Imax Road ,,Telangana
17.504176,78.47817001,+918042754444,https://restaurants.kfc.co.in/kfc-qutballapur-restaurants-qutballapur-hyderabad-35190/Home,"Survey No 91 to 93, Block G, RR Kompally, Jeedimetla, Qutballapur, Qutballapur, Hyderabad - 500067, Hyderabad, -, 500067", Qutballapur ,,Telangana
17.375353,78.557711,+919640694102,https://restaurants.kfc.co.in/kfc-kfc-nagole-hyderabad-restaurants-nagole-hyderabad-171880/Home,"GHMC No 2/4/70/26/1/2, No 72/141 to 144, Uppal Mandal, LB Nagar, Nagole, Nagole, Hyderabad - 500068, Hyderabad, -, 500068", KFC Nagole Hyderabad ,,Telangana
17.345787,78.568733,+918588808216,https://restaurants.kfc.co.in/kfc-kfc-sahara-road-restaurants-mansoorabad-hyderabad-253587/Home,"H No 3/9/585/6, GF, Shara Estate Gate 2, Vanastalipuram, Balaji Nagar, Mansoorabad, Mansoorabad, Hyderabad - 500068, Hyderabad, -, 500068", KFC Sahara Road ,,Telangana
17.323877,78.558067,+918019383572,https://restaurants.kfc.co.in/kfc-kfc-hastinapuram-hyderabad-restaurants-hastinapuram-hyderabad-284262/Home,"H No 8/6/59/11, Sy 59, Plot 11, Gr Flr, Christian Col, BN Reddy Ngr, Hastinapuram, Hastinapuram, Hyderabad - 500070, Hyderabad, -, 500070", KFC Hastinapuram Hyderabad ,,Telangana
17.4927101,78.4046301,+918042754444,https://restaurants.kfc.co.in/kfc-kukatpally-restaurants-kukatpally-hyderabad-35155/Home,"Ground Floor, South India Shopping Mall, Balanagar, KS Raju Nagar, Kukatpally, Kukatpally, Hyderabad - 500072, Hyderabad, -, 500072", Kukatpally ,,Telangana
17.488937,78.395978,+917396684714,https://restaurants.kfc.co.in/kfc-kfc-kphb-colony-restaurants-kukatpally-hyderabad-184669/Home,"No 24/497, Road No 4, KPHB Colony, Kukatpally, Kukatpally, Hyderabad - 500072, Hyderabad, -, 500072", KFC KPHB Colony ,,Telangana
17.484405,78.3890301,+918042754444,https://restaurants.kfc.co.in/kfc-kukatpally-restaurants-kukatpally-hyderabad-35198/Home,"Sy No 1009, 3rd Flr, Forum Sujana Mall, Kukatpally, Kukatpally, Hyderabad - 500072, Hyderabad, -, 500072", Kukatpally ,,Telangana
17.441778,78.377167,+917386104564,https://restaurants.kfc.co.in/kfc-kfc-raidurgam-restaurants-raidurgam-hyderabad-305304/Home,"Plot No 301, 1st Floor, HITECH city, Phase 2, Raidurgam, Raidurgam, Hyderabad - 500072, Hyderabad, -, 500072", KFC Raidurgam , Opposite Raheja Mind space IT ,Telangana
17.4353549,78.4448287,+917428399800,https://restaurants.kfc.co.in/kfc-kfc-ameerpet-metro-station-restaurants-ameerpet-metro-station-hyderabad-130430/Home,"No 1/619, A142, Ameerpet Road, Ameerpet Metro Station, Ameerpet Metro Station, Hyderabad - 500073, Hyderabad, -, 500073", KFC Ameerpet Metro station ,,Telangana
17.3912201,78.344274,+919640172216,https://restaurants.kfc.co.in/kfc-rajendra-nagar-restaurants-rajendra-nagar-rangareddy-102964/Home,"Shop No 2, Narsingi, Kokapet Road, Rajendra Nagar, Rajendra Nagar, Rangareddy - 500075, Rangareddy, -, 500075", Rajendra Nagar ,,Telangana
17.3898801,78.368231,+918466010329,https://restaurants.kfc.co.in/kfc-kfc-alkapuri-hyderabad-restaurants-manikonda-rangareddy-182739/Home,"No 5/1/2/245/102, Alkapur Township, Rangareddy, Manikonda, Manikonda, Rangareddy - 500075, Rangareddy, -, 500075", KFC Alkapuri Hyderabad ,,Telangana
17.425714,78.549498,+918019896171,https://restaurants.kfc.co.in/kfc-nacharam-main-road-restaurants-nacharam-main-road-hyderabad-34984/Home,"Shop No 7 & 8, Ground Floor, Spar Mall, Door No 4/7/27/A, Nacharam Main Road, Nacharam Main Road, Hyderabad - 500076, Hyderabad, -, 500076", Nacharam Main Road , Beside Andhara Bank ,Telangana
17.345718,78.5522201,+918042754444,https://restaurants.kfc.co.in/kfc-bahadurguda-restaurants-bahadurguda-rangareddy-35242/Home,"Sy No 49/7, 49/14 & 49/15, Saroornagar, Bahadurguda, Bahadurguda, Rangareddy - 500078, Rangareddy, -, 500078", Bahadurguda ,,Telangana
17.345481,78.522681,+919999307327,https://restaurants.kfc.co.in/kfc-kfc-champapet-hyderabad-restaurants-bairamalguda-hyderabad-127545/Home,"Karmanghat Main Road, Bairamalguda, Bairamalguda, Hyderabad - 500079, Hyderabad, -, 500079", KFC - Champapet Hyderabad ,,Telangana
17.423542,78.495253,+919398056563,https://restaurants.kfc.co.in/kfc-kfc-sattva-mall-secunderabad-restaurants-kavadiguda-hyderabad-325772/Home,"MCF 6/6/8 to 32 & 395, Sattva Mall, Secunderabad, Kavadiguda, Kavadiguda, Hyderabad - 500080, Hyderabad, -, 500080", KFC Sattva Mall Secunderabad , Opposite Kalpana Theater ,Telangana
17.450685,78.379411,+918042754444,https://restaurants.kfc.co.in/kfc-madhapur-restaurants-madhapur-hyderabad-35162/Home,"Hitech City, Shilpakala vedika, Madhapur, Madhapur, Hyderabad - 500081, Hyderabad, -, 500081", Madhapur , Opposite Cyber Towers ,Telangana
17.479606,78.417387,+919873729864,https://restaurants.kfc.co.in/kfc-ashoka-one-mall-hyderabad-restaurants-moosapet-hyderabad-292255/Home,"No 13, Survey No 118, 1st Floor, GHMC Municipal Corporation, Moosapet, Moosapet, Hyderabad - 500081, Hyderabad, -, 500081", Ashoka One Mall Hyderabad ,,Telangana
17.420569,78.455458,+918121494780,https://restaurants.kfc.co.in/kfc-kfc-erramanzil-restaurants-erramanzil-hyderabad-66125/Home,"S No 3/1, Counter No 4, L&T Mall, Erramanzil Metro Station, Erramanzil, Erramanzil, Hyderabad - 500082, Hyderabad, -, 500082", KFC Erramanzil ,,Telangana
17.422978,78.462341,+918042754444,https://restaurants.kfc.co.in/kfc-somajiguda-restaurants-somajiguda-hyderabad-35150/Home,"KFC Grand Building, Raj Bhavan Road, Somajiguda, Somajiguda, Hyderabad - 500082, Hyderabad, -, 500082", Somajiguda ,,Telangana
17.4290689,78.4500695,+919311312999,https://restaurants.kfc.co.in/kfc-punjagutta-restaurants-punjagutta-hyderabad-82041/Home,"L5 08, 1/1, 1/2, 1/3, 3/2, 6/1 & 6/2, Ward No 89, Punjagutta, Punjagutta, Hyderabad - 500082, Hyderabad, -, 500082", Punjagutta , Next To Panjagutta Metro Mall ,Telangana
17.450733,78.379471,+918042754444,https://restaurants.kfc.co.in/kfc-ranga-reddy-restaurants-ranga-reddy-hyderabad-35207/Home,"Plot No 2/1 & 2/2, LGF, Phoenix Tower A, Ranga Reddy, Ranga Reddy, Hyderabad - 500082, Hyderabad, -, 500082", Ranga Reddy , Opposite Trident Hotel ,Telangana
17.4266263,78.45292068,+919581158333,https://restaurants.kfc.co.in/kfc-kfc-central-mall-panjagutta-restaurants-panjagutta-hyderabad-325773/Home,"No 6/3/673/I, GS Centre, Panjagutta Cross Road, Panjagutta, Panjagutta, Hyderabad - 500082, Hyderabad, -, 500082", KFC Central Mall Panjagutta ,,Telangana
17.426571,78.4531101,+918042754444,https://restaurants.kfc.co.in/kfc-punjagutta-cross-rd-restaurants-punjagutta-cross-rd-hyderabad-35240/Home,"Plot No 6/3/673, 673/1, 6/3/674 & 674/1, Hyderabad Centrl Mall, Punjagutta Cross Rd, Punjagutta Cross Rd, Hyderabad - 500082, Hyderabad, -, 500082", Punjagutta Cross Rd ,,Telangana
17.4526701,78.4432901,+918042754444,https://restaurants.kfc.co.in/kfc-kondapur-restaurants-kondapur-hyderabad-82054/Home,"11, 4th Floor, Sarath City Capital Mall, Gachibowli Miyapur Rd, Kondapur, Kondapur, Hyderabad - 500084, Hyderabad, -, 500084", Kondapur , Near White Field Rd ,Telangana
17.4526701,78.4432901,+918185063619,https://restaurants.kfc.co.in/kfc-kondapur-restaurants-kondapur-hyderabad-64227/Home,"GF, Sarath City Capital Mall, Miyapur Rd, Gachibowli, White Field Road, Kondapur, Kondapur, Hyderabad - 500084, Hyderabad, -, 500084", Kondapur ,,Telangana
17.4701189,78.3543568,+918555942765,https://restaurants.kfc.co.in/kfc-kfc-kondapur-restaurants-kondapur-hyderabad-169720/Home,"Plot No 1421, Sy No 78 to 93, JSP Plaza, Raja Rajeshwar Nagar, Kondapur, Kondapur, Hyderabad - 500084, Hyderabad, -, 500084", KFC Kondapur ,,Telangana
17.484189,78.388771,+918042754444,https://restaurants.kfc.co.in/kfc-kukatpally-restaurants-kukatpally-hyderabad-78368/Home,"K P H B, Phase 9, Kukatpally, Kukatpally, Hyderabad - 500085, Hyderabad, -, 500085", Kukatpally ,,Telangana
17.4983469,78.3892464,+918929915205,https://restaurants.kfc.co.in/kfc-kukatpally-restaurants-kukatpally-hyderabad-79591/Home,"No 5 & 3, 1A, NH 65, JNTU Metro Station, Phase 2, Dharma Reddy Colony, Kukatpally, Kukatpally, Hyderabad - 500085, Hyderabad, -, 500085", Kukatpally ,,Telangana
17.419971,78.637087,+917396084232,https://restaurants.kfc.co.in/kfc-kfc-mjr-mall-narapally-restaurants-narepally-hyderabad-250666/Home,"Sy No 757, Korremula Road, NH 163, Narepally, Narepally, Hyderabad - 500088, Hyderabad, -, 500088", KFC MJR Mall Narapally ,,Telangana
17.447806,78.6324019,+918042754444,https://restaurants.kfc.co.in/kfc-pocharam-restaurants-pocharam-hyderabad-79596/Home,"Survey No 41 & 50, Infosys Limited, Sez, Singapore Township, Ghatkesar, Pocharam, Pocharam, Hyderabad - 500088, Hyderabad, -, 500088", Pocharam ,,Telangana
17.523111,78.395111,+919873020692,https://restaurants.kfc.co.in/kfc-kfc-pragathi-nagar-restaurants-pragathi-nagar-rangareddy-166107/Home,"H No 06/53/159/1527, Lehari Estates, JNTU, Pragathi Nagar, Pragathi Nagar, Rangareddy - 500090, Rangareddy, -, 500090", KFC Pragathi Nagar ,,Telangana
17.3660801,78.397957,+918885230907,https://restaurants.kfc.co.in/kfc-hydershakote-restaurants-hydershakote-hyderabad-121681/Home,"Plot No 10, Survey No 9/7, Hydershakote, Hydershakote, Hyderabad - 500091, Hyderabad, -, 500091", Hydershakote ,,Telangana
17.4892685,78.5405027,+918588835309,https://restaurants.kfc.co.in/kfc-kfc-sainikpuri-hyderabad-restaurants-sainikpuri-secunderabad-249616/Home,"37/18/1A/S/1, Defence Colony, Sainikpuri, Sainikpuri, Secunderabad - 500094, Secunderabad, -, 500094", KFC Sainikpuri Hyderabad ,,Telangana
17.484806,78.5658801,+919711423551,https://restaurants.kfc.co.in/kfc-kfc-saket-road-hyderabad-restaurants-sriram-nagar-secunderabad-198534/Home,"Kapra, Road No 1, Secunderabad, Sriram Nagar, Sriram Nagar, Secunderabad - 500094, Secunderabad, -, 500094", KFC Saket Road Hyderabad , Beside City Paradaise Restaurant ,Telangana
17.2364165,78.4299384,+918042754444,https://restaurants.kfc.co.in/kfc-shamshabad-restaurants-shamshabad-hyderabad-34912/Home,"No 87, The Food Court Level C Parking, RGIA, Shamshabad, Shamshabad, Hyderabad - 501218, Hyderabad, -, 501218", Shamshabad ,,Telangana
17.2402633,78.4293851,+918042754444,https://restaurants.kfc.co.in/kfc-shamshabad-restaurants-shamshabad-hyderabad-34996/Home,"Rajiv Gandhi International Airport, Passenger Terminal Building, Shamshabad, Shamshabad, Hyderabad - 501218, Hyderabad, -, 501218", Shamshabad ,,Telangana
17.591202,78.084762,+919885175651,https://restaurants.kfc.co.in/kfc-kfc-sangareddy-restaurants-sangareddy-main-road-sangareddy-171518/Home,"Ground Floor, Sangareddy Main Road, Sangareddy Main Road, Sangareddy - 502001, Sangareddy, -, 502001", KFC Sangareddy ,,Telangana
17.524909,78.299179,+917075551860,https://restaurants.kfc.co.in/kfc-kfc-beeramguda-restaurants-ramachandrapuram-hyderabad-192656/Home,"Plot No 9, Krishna Reddy Pet Road, Beeramguda, Ramachandrapuram, Ramachandrapuram, Hyderabad - 502032, Hyderabad, -, 502032", KFC Beeramguda ,,Telangana
17.5081928,78.3016162,+917989928198,https://restaurants.kfc.co.in/kfc-kfc-rc-puram-restaurants-ramachandra-reddy-nagar-colony-hyderabad-198558/Home,"No 25/35/11/C, Ramchandra Puram, NH 65, Ramachandra Reddy Nagar Colony, Ramachandra Reddy Nagar Colony, Hyderabad - 502032, Hyderabad, -, 502032", KFC RC Puram , Opposite Beerumguda Kaman ,Telangana
18.0831923,78.857521,+918340000221,https://restaurants.kfc.co.in/kfc-kfc-mytri-vanam-siddipet-restaurants-maitri-vanam-siddipet-204317/Home,"Ground Floor, Laxmi Narasimha Complex, Hyderabad Road, Maitri Vanam, Maitri Vanam, Siddipet - 502103, Siddipet, -, 502103", KFC Mytri Vanam Siddipet , Near Nlock Office ,Telangana
17.863093,78.743597,+918340000221,https://restaurants.kfc.co.in/kfc-kfc-karimnagar-highway-restaurants-rimmanaguda-medak-171229/Home,"S/4, Food Court & Filling Station, Gajwel Mandal, Rimmanaguda, Rimmanaguda, Medak - 502312, Medak, -, 502312", KFC Karimnagar Highway ,,Telangana
18.669001,78.105001,+919311668555,https://restaurants.kfc.co.in/kfc-phulong-road-restaurants-phulong-road-nizamabad-99117/Home,"Shop No 2, Ground Floor, Venu Mall, Hyderabad Road, Phulong Road, Phulong Road, Nizamabad - 503001, Nizamabad, -, 503001", Phulong Road ,,Telangana
18.788121,78.291811,+919966387700,https://restaurants.kfc.co.in/kfc-kfc-armoor-nizamabad-restaurants-armoor-armoor-127543/Home,"Jeevan Reddy Mall, Main Road, Armoor, Armoor, Armoor - 503224, Armoor, -, 503224", KFC - Armoor Nizamabad , Besides Bus Stand ,Telangana
17.9960487,79.5508955,+919311668554,https://restaurants.kfc.co.in/kfc-hanamkonda-restaurants-hanamkonda-warangal-35194/Home,"H No 1/7/762 to 1/7/764, Ward No 1, GF, Block No 7, Adalath, Hanamkonda, Hanamkonda, Warangal - 506002, Warangal, -, 506002", Hanamkonda , Beside DEO Office ,Telangana
17.064384,79.265411,+918588810136,https://restaurants.kfc.co.in/kfc-kfc-nalgonda-restaurants-sri-laxmi-nagar-colony-nalgonda-182740/Home,"Ground Floor, Sri Laxmi Nagar Colony, Sri Laxmi Nagar Colony, Nalgonda - 508001, Nalgonda, -, 508001", KFC Nalgonda , Opposite More Super Market ,Telangana
17.15078363,79.57707727,+917730966065,https://restaurants.kfc.co.in/kfc-kfc-suryapet-restaurants-rayangudem-suryapet-79592/Home,"No 7, Food Court, NH 65, Rayangudem, Rayangudem, Suryapet - 508213, Suryapet, -, 508213", KFC Suryapet ,,Telangana
23.834125,91.280731,+917303419299,https://restaurants.kfc.co.in/kfc-shakuntala-road-restaurants-shakuntala-road-agartala-34977/Home,"KFC Restaurant 6, Shakuntala Road, Shakuntala Road, Agartala - 799001, Agartala, -, 799001", Shakuntala Road , Opposite of Rabindra Satabarshik Bhawan ,Tripura
23.8247413,91.2703649,+919711128801,https://restaurants.kfc.co.in/kfc-nagerjala-agartala-restaurants-bordiwali-west-tripura-292640/Home,"Ground Floor, Nandini Mansion, Bordiwali, Bordiwali, West Tripura - 799003, West Tripura, -, 799003", Nagerjala Agartala , Near Pillar No 30 ,Tripura
28.702681,77.428901,+917042253969,https://restaurants.kfc.co.in/kfc-kfc-raj-nagar-extension-restaurants-raj-nagar-extension-ghaziabad-132457/Home,"Ground Floor,GNB Mall, NH 58, Bypass Road, Raj Nagar Extension, Raj Nagar Extension, Ghaziabad - 201001, Ghaziabad, -, 201001", KFC Raj Nagar Extension ,,Uttar Pradesh
28.628777,77.4404901,+919643001607,https://restaurants.kfc.co.in/kfc-crossing-republic-restaurants-crossing-republic-ghaziabad-34948/Home,"SN 4 to 9, 1st Floor, Paramount Symphony, NH 24, Crossing Republic, Crossing Republic, Ghaziabad - 201001, Ghaziabad, -, 201001", Crossing Republic ,,Uttar Pradesh
